tripinfo_arrival;tripinfo_arrivalLane;tripinfo_arrivalPos;tripinfo_arrivalPosLat;tripinfo_arrivalSpeed;tripinfo_depart;tripinfo_departDelay;tripinfo_departLane;tripinfo_departPos;tripinfo_departPosLat;tripinfo_departSpeed;tripinfo_devices;tripinfo_duration;tripinfo_id;tripinfo_rerouteNo;tripinfo_routeLength;tripinfo_speedFactor;tripinfo_stopTime;tripinfo_timeLoss;tripinfo_vType;tripinfo_vaporized;tripinfo_waitingCount;tripinfo_waitingTime;emissions_CO2_abs;emissions_CO_abs;emissions_HC_abs;emissions_NOx_abs;emissions_PMx_abs;emissions_electricity_abs;emissions_fuel_abs
14.80;-road3_0;19.96;0.00;11.13;0.40;0.00;road0_0;4.10;0.00;6.33;tripinfo_vehicle_52 emissions_vehicle_52 battery_vehicle_52;14.40;vehicle_52;0;122.77;1.02;0.00;4.38;human;;0;0.00;0;0;0;0;0;46.878596;0
15.60;-road1_0;19.96;0.00;12.69;1.60;0.00;road2_0;4.10;0.00;8.40;tripinfo_vehicle_76 routing_vehicle_76 emissions_vehicle_76 battery_vehicle_76;14.00;vehicle_76;1;122.77;1.03;0.00;3.67;human;;0;0.00;0;0;0;0;0;50.606090;0
16.40;-road0_0;19.96;0.00;12.08;1.60;0.00;road1_0;4.10;0.00;9.75;tripinfo_vehicle_64 routing_vehicle_64 emissions_vehicle_64 battery_vehicle_64;14.80;vehicle_64;1;122.77;0.94;0.00;3.99;human;;0;0.00;0;0;0;0;0;36.839249;0
16.40;-road2_0;19.96;0.00;12.72;1.60;0.00;road3_0;4.10;0.00;5.40;tripinfo_vehicle_70 routing_vehicle_70 emissions_vehicle_70 battery_vehicle_70;14.80;vehicle_70;1;122.77;1.02;0.00;4.19;human;;0;0.00;0;0;0;0;0;60.326959;0
20.00;-road1_0;19.96;0.00;12.56;0.40;0.00;road3_0;4.10;0.00;8.17;tripinfo_rl_0 routing_rl_0 emissions_rl_0 battery_rl_0 ssm_rl_0 driverstaterl_0;19.60;rl_0;1;206.37;1.03;0.00;3.14;rlAnget;;0;0.00;0;0;0;0;0;74.091694;0
