tripinfo_arrival;tripinfo_arrivalLane;tripinfo_arrivalPos;tripinfo_arrivalPosLat;tripinfo_arrivalSpeed;tripinfo_depart;tripinfo_departDelay;tripinfo_departLane;tripinfo_departPos;tripinfo_departPosLat;tripinfo_departSpeed;tripinfo_devices;tripinfo_duration;tripinfo_id;tripinfo_rerouteNo;tripinfo_routeLength;tripinfo_speedFactor;tripinfo_stopTime;tripinfo_timeLoss;tripinfo_vType;tripinfo_vaporized;tripinfo_waitingCount;tripinfo_waitingTime;emissions_CO2_abs;emissions_CO_abs;emissions_HC_abs;emissions_NOx_abs;emissions_PMx_abs;emissions_electricity_abs;emissions_fuel_abs
14.00;-road2_0;19.96;0.00;13.03;0.40;0.00;road3_0;4.10;0.00;6.33;tripinfo_vehicle_60 routing_vehicle_60 emissions_vehicle_60 battery_vehicle_60;13.60;vehicle_60;1;122.77;1.08;0.00;3.47;human;;0;0.00;0;0;0;0;0;60.937817;0
16.80;-road3_0;19.96;0.00;11.42;0.80;0.00;road0_0;4.10;0.00;0.10;tripinfo_vehicle_36 emissions_vehicle_36 battery_vehicle_36;16.00;vehicle_36;0;122.77;0.97;0.00;5.24;human;;0;0.00;0;0;0;0;0;58.154726;0
18.40;-road2_0;19.96;0.00;11.48;1.60;0.00;road3_0;4.10;0.00;1.07;tripinfo_vehicle_47 routing_vehicle_47 emissions_vehicle_47 battery_vehicle_47;16.80;vehicle_47;1;122.77;0.90;0.00;5.22;human;;0;0.00;0;0;0;0;0;55.214108;0
19.60;-road1_0;19.96;0.00;12.75;5.20;0.00;road2_0;4.10;0.00;4.20;tripinfo_vehicle_33 routing_vehicle_33 emissions_vehicle_33 battery_vehicle_33;14.40;vehicle_33;1;122.77;1.17;0.00;4.55;human;;0;0.00;0;0;0;0;0;64.365680;0
20.40;-road0_0;19.96;0.00;12.70;4.00;0.80;road1_0;4.10;0.00;3.49;tripinfo_rl_0 routing_rl_0 emissions_rl_0 battery_rl_0 ssm_rl_0 driverstaterl_0;16.40;rl_0;1;122.77;1.03;0.00;5.96;rlAnget;;0;0.00;0;0;0;0;0;63.815412;0
