tripinfo_arrival;tripinfo_arrivalLane;tripinfo_arrivalPos;tripinfo_arrivalPosLat;tripinfo_arrivalSpeed;tripinfo_depart;tripinfo_departDelay;tripinfo_departLane;tripinfo_departPos;tripinfo_departPosLat;tripinfo_departSpeed;tripinfo_devices;tripinfo_duration;tripinfo_id;tripinfo_rerouteNo;tripinfo_routeLength;tripinfo_speedFactor;tripinfo_stopTime;tripinfo_timeLoss;tripinfo_vType;tripinfo_vaporized;tripinfo_waitingCount;tripinfo_waitingTime;emissions_CO2_abs;emissions_CO_abs;emissions_HC_abs;emissions_NOx_abs;emissions_PMx_abs;emissions_electricity_abs;emissions_fuel_abs
14.80;-road2_0;19.96;0.00;12.37;0.80;0.00;road3_0;4.10;0.00;8.13;tripinfo_vehicle_63 routing_vehicle_63 emissions_vehicle_63 battery_vehicle_63;14.00;vehicle_63;1;122.77;0.99;0.00;3.76;human;;0;0.00;0;0;0;0;0;49.185298;0
18.40;-road2_0;19.96;0.00;11.39;2.80;0.00;road3_0;4.10;0.00;6.54;tripinfo_vehicle_77 routing_vehicle_77 emissions_vehicle_77 battery_vehicle_77;15.60;vehicle_77;1;122.77;0.98;0.00;5.24;human;;0;0.00;0;0;0;0;0;44.767024;0
18.80;-road3_0;19.96;0.00;11.60;4.80;0.00;road0_0;4.10;0.00;6.19;tripinfo_vehicle_28 emissions_vehicle_28 battery_vehicle_28;14.00;vehicle_28;0;122.77;1.13;0.00;3.86;human;;0;0.00;0;0;0;0;0;50.959890;0
22.00;-road0_0;19.96;0.00;13.23;0.80;0.00;road2_0;4.10;0.00;0.10;tripinfo_vehicle_10 routing_vehicle_10 emissions_vehicle_10 battery_vehicle_10;21.20;vehicle_10;1;206.37;1.09;0.00;4.99;human;;0;0.00;0;0;0;0;0;92.946893;0
23.20;-road2_0;19.96;0.00;11.08;0.00;0.00;road0_0;4.10;0.00;5.68;tripinfo_vehicle_23 emissions_vehicle_23 battery_vehicle_23;23.20;vehicle_23;0;206.37;0.89;0.00;4.86;human;;0;0.00;0;0;0;0;0;62.146391;0
24.00;-road0_0;19.96;0.00;12.97;2.80;2.00;road2_0;4.10;0.00;3.86;tripinfo_rl_0 routing_rl_0 emissions_rl_0 battery_rl_0 ssm_rl_0 driverstaterl_0;21.20;rl_0;1;206.37;1.03;0.00;4.96;rlAnget;;0;0.00;0;0;0;0;0;89.811576;0
