tripinfo_arrival;tripinfo_arrivalLane;tripinfo_arrivalPos;tripinfo_arrivalPosLat;tripinfo_arrivalSpeed;tripinfo_depart;tripinfo_departDelay;tripinfo_departLane;tripinfo_departPos;tripinfo_departPosLat;tripinfo_departSpeed;tripinfo_devices;tripinfo_duration;tripinfo_id;tripinfo_rerouteNo;tripinfo_routeLength;tripinfo_speedFactor;tripinfo_stopTime;tripinfo_timeLoss;tripinfo_vType;tripinfo_vaporized;tripinfo_waitingCount;tripinfo_waitingTime;emissions_CO2_abs;emissions_CO_abs;emissions_HC_abs;emissions_NOx_abs;emissions_PMx_abs;emissions_electricity_abs;emissions_fuel_abs
17.60;-road2_0;19.96;0.00;11.51;2.00;0.00;road3_0;4.10;0.00;5.65;tripinfo_vehicle_7 routing_vehicle_7 emissions_vehicle_7 battery_vehicle_7;15.60;vehicle_7;1;122.77;0.89;0.00;3.95;human;;0;0.00;0;0;0;0;0;48.303036;0
21.60;-road2_0;19.96;0.00;13.33;4.80;0.80;road3_0;4.10;0.00;3.40;tripinfo_vehicle_21 routing_vehicle_21 emissions_vehicle_21 battery_vehicle_21;16.80;vehicle_21;1;122.77;1.01;0.00;6.19;human;;0;0.00;0;0;0;0;0;66.969573;0
22.40;-road3_0;19.96;0.00;11.71;7.20;0.00;road0_0;4.10;0.00;4.76;tripinfo_vehicle_38 emissions_vehicle_38 battery_vehicle_38;15.20;vehicle_38;0;122.77;1.10;0.00;5.13;human;;0;0.00;0;0;0;0;0;55.583445;0
25.20;-road3_0;19.96;0.00;12.92;4.00;0.00;road1_0;4.10;0.00;1.52;tripinfo_vehicle_76 routing_vehicle_76 emissions_vehicle_76 battery_vehicle_76;21.20;vehicle_76;1;206.37;1.03;0.00;4.72;human;;0;0.00;0;0;0;0;0;88.281279;0
26.40;-road2_0;19.96;0.00;11.17;3.60;0.00;road0_0;4.10;0.00;9.59;tripinfo_vehicle_15 emissions_vehicle_15 battery_vehicle_15;22.80;vehicle_15;0;206.37;0.93;0.00;5.20;human;;0;0.00;0;0;0;0;0;49.183678;0
26.80;-road0_0;19.96;0.00;13.00;4.40;1.20;road2_0;4.10;0.00;0.16;tripinfo_rl_0 routing_rl_0 emissions_rl_0 battery_rl_0;22.40;rl_0;1;206.37;1.03;0.00;5.81;rlAnget;;0;0.00;0;0;0;0;0;92.878663;0
