tripinfo_arrival;tripinfo_arrivalLane;tripinfo_arrivalPos;tripinfo_arrivalPosLat;tripinfo_arrivalSpeed;tripinfo_depart;tripinfo_departDelay;tripinfo_departLane;tripinfo_departPos;tripinfo_departPosLat;tripinfo_departSpeed;tripinfo_devices;tripinfo_duration;tripinfo_id;tripinfo_rerouteNo;tripinfo_routeLength;tripinfo_speedFactor;tripinfo_stopTime;tripinfo_timeLoss;tripinfo_vType;tripinfo_vaporized;tripinfo_waitingCount;tripinfo_waitingTime;emissions_CO2_abs;emissions_CO_abs;emissions_HC_abs;emissions_NOx_abs;emissions_PMx_abs;emissions_electricity_abs;emissions_fuel_abs
14.40;-road1_0;19.96;0.00;12.99;1.20;0.00;road2_0;4.10;0.00;10.54;tripinfo_vehicle_61 routing_vehicle_61 emissions_vehicle_61 battery_vehicle_61;13.20;vehicle_61;1;122.77;1.12;0.00;2.92;human;;0;0.00;0;0;0;0;0;42.513095;0
17.20;-road0_0;19.96;0.00;12.96;2.40;0.40;road1_0;4.10;0.00;0.16;tripinfo_vehicle_3 routing_vehicle_3 emissions_vehicle_3 battery_vehicle_3;14.80;vehicle_3;1;122.77;1.08;0.00;4.42;human;;0;0.00;0;0;0;0;0;70.861357;0
18.00;-road1_0;19.96;0.00;12.19;3.20;0.00;road2_0;4.10;0.00;9.01;tripinfo_vehicle_63 routing_vehicle_63 emissions_vehicle_63 battery_vehicle_63;14.80;vehicle_63;1;122.77;0.99;0.00;4.29;human;;0;0.00;0;0;0;0;0;42.805984;0
18.80;-road2_0;19.96;0.00;11.66;4.00;0.00;road3_0;4.10;0.00;5.64;tripinfo_vehicle_39 routing_vehicle_39 emissions_vehicle_39 battery_vehicle_39;14.80;vehicle_39;1;122.77;0.90;0.00;3.44;human;;0;0.00;0;0;0;0;0;50.552381;0
18.80;-road3_0;19.96;0.00;11.63;2.40;0.80;road0_0;4.10;0.00;2.80;tripinfo_vehicle_57 emissions_vehicle_57 battery_vehicle_57;16.40;vehicle_57;0;122.77;1.14;0.00;6.29;human;;0;0.00;0;0;0;0;0;58.587503;0
20.40;-road1_0;19.96;0.00;13.50;1.60;0.00;road3_0;4.10;0.00;10.54;tripinfo_rl_0 routing_rl_0 emissions_rl_0 battery_rl_0;18.80;rl_0;1;206.37;1.03;0.00;2.57;rlAnget;;0;0.00;0;0;0;0;0;70.663791;0
