tripinfo_arrival;tripinfo_arrivalLane;tripinfo_arrivalPos;tripinfo_arrivalPosLat;tripinfo_arrivalSpeed;tripinfo_depart;tripinfo_departDelay;tripinfo_departLane;tripinfo_departPos;tripinfo_departPosLat;tripinfo_departSpeed;tripinfo_devices;tripinfo_duration;tripinfo_id;tripinfo_rerouteNo;tripinfo_routeLength;tripinfo_speedFactor;tripinfo_stopTime;tripinfo_timeLoss;tripinfo_vType;tripinfo_vaporized;tripinfo_waitingCount;tripinfo_waitingTime;emissions_CO2_abs;emissions_CO_abs;emissions_HC_abs;emissions_NOx_abs;emissions_PMx_abs;emissions_electricity_abs;emissions_fuel_abs
15.60;-road3_0;19.96;0.00;11.13;1.20;0.00;road0_0;4.10;0.00;6.33;tripinfo_vehicle_52 emissions_vehicle_52 battery_vehicle_52;14.40;vehicle_52;0;122.77;1.02;0.00;4.43;human;;0;0.00;0;0;0;0;0;46.953029;0
18.00;-road1_0;19.96;0.00;12.57;3.20;0.00;road2_0;4.10;0.00;5.43;tripinfo_vehicle_55 routing_vehicle_55 emissions_vehicle_55 battery_vehicle_55;14.80;vehicle_55;1;122.77;1.00;0.00;4.52;human;;0;0.00;0;0;0;0;0;58.276828;0
19.20;-road0_0;19.96;0.00;12.99;4.40;1.20;road1_0;4.10;0.00;3.67;tripinfo_vehicle_42 routing_vehicle_42 emissions_vehicle_42 battery_vehicle_42;14.80;vehicle_42;1;122.77;1.09;0.00;4.53;human;;0;0.00;0;0;0;0;0;67.054535;0
22.80;-road0_0;19.96;0.00;12.17;1.60;0.00;road2_0;4.10;0.00;8.17;tripinfo_vehicle_54 routing_vehicle_54 emissions_vehicle_54 battery_vehicle_54;21.20;vehicle_54;1;206.37;1.00;0.00;4.77;human;;0;0.00;0;0;0;0;0;66.389829;0
24.40;-road1_0;19.96;0.00;12.07;1.60;0.00;road3_0;4.10;0.00;0.10;tripinfo_vehicle_22 routing_vehicle_22 emissions_vehicle_22 battery_vehicle_22;22.80;vehicle_22;1;206.37;0.97;0.00;5.88;human;;0;0.00;0;0;0;0;0;80.743523;0
26.00;-road1_0;19.96;0.00;12.50;3.60;0.80;road3_0;4.10;0.00;0.16;tripinfo_rl_0 routing_rl_0 emissions_rl_0 battery_rl_0;22.40;rl_0;1;206.37;1.03;0.00;6.01;rlAnget;;0;0.00;0;0;0;0;0;86.065680;0
