tripinfo_arrival;tripinfo_arrivalLane;tripinfo_arrivalPos;tripinfo_arrivalPosLat;tripinfo_arrivalSpeed;tripinfo_depart;tripinfo_departDelay;tripinfo_departLane;tripinfo_departPos;tripinfo_departPosLat;tripinfo_departSpeed;tripinfo_devices;tripinfo_duration;tripinfo_id;tripinfo_rerouteNo;tripinfo_routeLength;tripinfo_speedFactor;tripinfo_stopTime;tripinfo_timeLoss;tripinfo_vType;tripinfo_vaporized;tripinfo_waitingCount;tripinfo_waitingTime;emissions_CO2_abs;emissions_CO_abs;emissions_HC_abs;emissions_NOx_abs;emissions_PMx_abs;emissions_electricity_abs;emissions_fuel_abs
15.60;-road2_0;19.96;0.00;12.09;0.80;0.00;road3_0;4.10;0.00;7.76;tripinfo_vehicle_17 routing_vehicle_17 emissions_vehicle_17 battery_vehicle_17;14.80;vehicle_17;1;122.77;0.94;0.00;3.67;human;;0;0.00;0;0;0;0;0;47.105335;0
16.80;-road1_0;19.96;0.00;11.99;0.40;0.00;road2_0;4.10;0.00;0.10;tripinfo_vehicle_64 routing_vehicle_64 emissions_vehicle_64 battery_vehicle_64;16.40;vehicle_64;1;122.77;0.94;0.00;5.20;human;;0;0.00;0;0;0;0;0;59.947831;0
18.40;-road3_0;19.96;0.00;11.17;1.60;0.40;road0_0;4.10;0.00;4.97;tripinfo_vehicle_18 emissions_vehicle_18 battery_vehicle_18;16.80;vehicle_18;0;122.77;0.94;0.00;5.47;human;;0;0.00;0;0;0;0;0;49.133665;0
18.40;-road0_0;19.96;0.00;13.22;3.60;0.00;road1_0;4.10;0.00;0.16;tripinfo_vehicle_79 routing_vehicle_79 emissions_vehicle_79 battery_vehicle_79;14.80;vehicle_79;1;122.77;1.09;0.00;4.61;human;;0;0.00;0;0;0;0;0;72.975294;0
19.20;-road2_0;19.96;0.00;11.56;1.60;0.00;road3_0;4.10;0.00;5.57;tripinfo_vehicle_50 routing_vehicle_50 emissions_vehicle_50 battery_vehicle_50;17.60;vehicle_50;1;122.77;0.85;0.00;5.65;human;;0;0.00;0;0;0;0;0;47.581055;0
20.00;-road1_0;19.96;0.00;12.32;2.80;0.00;road2_0;4.10;0.00;1.52;tripinfo_rl_0 routing_rl_0 emissions_rl_0 battery_rl_0;17.20;rl_0;1;122.77;1.03;0.00;6.74;rlAnget;;0;0.00;0;0;0;0;0;59.816437;0
